00:00.0 Host bridge [0600]: Intel Corporation 440FX - 82441FX PMC [Natoma] [8086:1237] (rev 02)
	Control: I/O- Mem- BusMaster- SpecCycle- MemWINV- VGASnoop- ParErr- Stepping- SERR- FastB2B- DisINTx-
	Status: Cap- 66MHz- UDF- FastB2B- ParErr- DEVSEL=fast >TAbort- <TAbort- <MAbort- >SERR- <PERR- INTx-

00:01.0 ISA bridge [0601]: Intel Corporation 82371SB PIIX3 ISA [Natoma/Triton II] [8086:7000]
	Control: I/O+ Mem+ BusMaster+ SpecCycle- MemWINV- VGASnoop- ParErr- Stepping- SERR- FastB2B- DisINTx-
	Status: Cap- 66MHz- UDF- FastB2B- ParErr- DEVSEL=medium >TAbort- <TAbort- <MAbort- >SERR- <PERR- INTx-
	Latency: 0

00:01.1 IDE interface [0101]: Intel Corporation 82371AB/EB/MB PIIX4 IDE [8086:7111] (rev 01) (prog-if 8a [ISA Compatibility mode controller, supports both channels switched to PCI native mode, supports bus mastering])
	Control: I/O+ Mem+ BusMaster+ SpecCycle- MemWINV- VGASnoop- ParErr- Stepping- SERR- FastB2B- DisINTx-
	Status: Cap- 66MHz- UDF- FastB2B- ParErr- DEVSEL=fast >TAbort- <TAbort- <MAbort- >SERR- <PERR- INTx-
	Latency: 64
	Region 0: I/O ports at 01f0 [size=8]
	Region 1: I/O ports at 03f4
	Region 2: I/O ports at 0170 [size=8]
	Region 3: I/O ports at 0374
	Region 4: I/O ports at d000 [size=16]
	Kernel driver in use: ata_piix
	Kernel modules: ata_piix, ata_generic

00:02.0 VGA compatible controller [0300]: VMware SVGA II Adapter [15ad:0405] (prog-if 00 [VGA controller])
	Subsystem: VMware SVGA II Adapter [15ad:0405]
	Control: I/O+ Mem+ BusMaster+ SpecCycle- MemWINV- VGASnoop- ParErr- Stepping- SERR- FastB2B- DisINTx-
	Status: Cap- 66MHz- UDF- FastB2B- ParErr- DEVSEL=fast >TAbort- <TAbort- <MAbort- >SERR- <PERR- INTx-
	Latency: 64
	Interrupt: pin A routed to IRQ 18
	Region 0: I/O ports at d010 [size=16]
	Region 1: Memory at e0000000 (32-bit, prefetchable) [size=16M]
	Region 2: Memory at f0000000 (32-bit, non-prefetchable) [size=2M]
	Expansion ROM at 000c0000 [virtual] [disabled] [size=128K]
	Kernel driver in use: vmwgfx
	Kernel modules: vmwgfx

00:03.0 Ethernet controller [0200]: Intel Corporation 82540EM Gigabit Ethernet Controller [8086:100e] (rev 02)
	Subsystem: Intel Corporation PRO/1000 MT Desktop Adapter [8086:001e]
	Control: I/O+ Mem+ BusMaster+ SpecCycle- MemWINV- VGASnoop- ParErr- Stepping- SERR- FastB2B- DisINTx-
	Status: Cap+ 66MHz+ UDF- FastB2B- ParErr- DEVSEL=medium >TAbort- <TAbort- <MAbort- >SERR- <PERR- INTx-
	Latency: 64 (63750ns min)
	Interrupt: pin A routed to IRQ 19
	Region 0: Memory at f0200000 (32-bit, non-prefetchable) [size=128K]
	Region 2: I/O ports at d020 [size=8]
	Capabilities: [dc] Power Management version 2
		Flags: PMEClk- DSI+ D1- D2- AuxCurrent=0mA PME(D0-,D1-,D2-,D3hot-,D3cold-)
		Status: D0 NoSoftRst- PME-Enable- DSel=0 DScale=0 PME-
	Capabilities: [e4] PCI-X non-bridge device
		Command: DPERE- ERO+ RBC=512 OST=1
		Status: Dev=ff:1f.0 64bit- 133MHz- SCD- USC- DC=simple DMMRBC=2048 DMOST=1 DMCRS=8 RSCEM- 266MHz- 533MHz-
	Kernel driver in use: e1000
	Kernel modules: e1000

00:04.0 System peripheral [0880]: InnoTek Systemberatung GmbH VirtualBox Guest Service [80ee:cafe]
	Control: I/O+ Mem+ BusMaster- SpecCycle- MemWINV- VGASnoop- ParErr- Stepping- SERR- FastB2B- DisINTx-
	Status: Cap- 66MHz- UDF- FastB2B- ParErr- DEVSEL=fast >TAbort- <TAbort- <MAbort- >SERR- <PERR- INTx-
	Interrupt: pin A routed to IRQ 20
	Region 0: I/O ports at d040 [size=32]
	Region 1: Memory at f0400000 (32-bit, non-prefetchable) [size=4M]
	Region 2: Memory at f0800000 (32-bit, prefetchable) [size=16K]
	Kernel driver in use: vboxguest
	Kernel modules: vboxguest

00:05.0 Multimedia audio controller [0401]: Intel Corporation 82801AA AC'97 Audio Controller [8086:2415] (rev 01)
	Subsystem: Dell Device [1028:0177]
	Control: I/O+ Mem- BusMaster+ SpecCycle- MemWINV- VGASnoop- ParErr- Stepping- SERR- FastB2B- DisINTx-
	Status: Cap- 66MHz- UDF- FastB2B+ ParErr- DEVSEL=medium >TAbort- <TAbort- <MAbort- >SERR- <PERR- INTx-
	Latency: 64
	Interrupt: pin A routed to IRQ 21
	Region 0: I/O ports at d100 [size=256]
	Region 1: I/O ports at d200 [size=64]
	Kernel driver in use: snd_intel8x0
	Kernel modules: snd_intel8x0

00:06.0 USB controller [0c03]: Apple Inc. KeyLargo/Intrepid USB [106b:003f] (prog-if 10 [OHCI])
	Control: I/O- Mem+ BusMaster+ SpecCycle- MemWINV- VGASnoop- ParErr- Stepping- SERR- FastB2B- DisINTx-
	Status: Cap+ 66MHz- UDF- FastB2B- ParErr- DEVSEL=fast >TAbort- <TAbort- <MAbort- >SERR- <PERR- INTx-
	Latency: 64
	Interrupt: pin A routed to IRQ 22
	Region 0: Memory at f0804000 (32-bit, non-prefetchable) [size=4K]
	Kernel driver in use: ohci-pci
	Kernel modules: ohci_pci

00:07.0 Bridge [0680]: Intel Corporation 82371AB/EB/MB PIIX4 ACPI [8086:7113] (rev 08)
	Control: I/O+ Mem- BusMaster- SpecCycle- MemWINV- VGASnoop- ParErr- Stepping- SERR- FastB2B- DisINTx-
	Status: Cap- 66MHz- UDF- FastB2B+ ParErr- DEVSEL=medium >TAbort- <TAbort- <MAbort- >SERR- <PERR- INTx-
	Interrupt: pin A routed to IRQ 9
	Kernel driver in use: piix4_smbus
	Kernel modules: i2c_piix4

00:0b.0 USB controller [0c03]: Intel Corporation 82801FB/FBM/FR/FW/FRW (ICH6 Family) USB2 EHCI Controller [8086:265c] (prog-if 20 [EHCI])
	Control: I/O- Mem+ BusMaster+ SpecCycle- MemWINV+ VGASnoop- ParErr- Stepping- SERR- FastB2B- DisINTx-
	Status: Cap+ 66MHz- UDF- FastB2B- ParErr- DEVSEL=fast >TAbort- <TAbort- <MAbort- >SERR- <PERR- INTx-
	Latency: 64, Cache Line Size: 64 bytes
	Interrupt: pin A routed to IRQ 19
	Region 0: Memory at f0805000 (32-bit, non-prefetchable) [size=4K]
	Kernel driver in use: ehci-pci
	Kernel modules: ehci_pci

00:0d.0 SATA controller [0106]: Intel Corporation 82801HM/HEM (ICH8M/ICH8M-E) SATA Controller [AHCI mode] [8086:2829] (rev 02) (prog-if 01 [AHCI 1.0])
	Control: I/O+ Mem+ BusMaster+ SpecCycle- MemWINV- VGASnoop- ParErr- Stepping- SERR- FastB2B- DisINTx-
	Status: Cap+ 66MHz- UDF- FastB2B- ParErr- DEVSEL=fast >TAbort- <TAbort- <MAbort- >SERR- <PERR- INTx-
	Latency: 64
	Interrupt: pin A routed to IRQ 21
	Region 0: I/O ports at d240 [size=8]
	Region 1: I/O ports at d248 [size=4]
	Region 2: I/O ports at d250 [size=8]
	Region 3: I/O ports at d258 [size=4]
	Region 4: I/O ports at d260 [size=16]
	Region 5: Memory at f0806000 (32-bit, non-prefetchable) [size=8K]
	Capabilities: [70] Power Management version 3
		Flags: PMEClk- DSI- D1- D2- AuxCurrent=0mA PME(D0-,D1-,D2-,D3hot-,D3cold-)
		Status: D0 NoSoftRst- PME-Enable- DSel=0 DScale=0 PME-
	Capabilities: [a8] SATA HBA v1.0 BAR4 Offset=00000002
	Kernel driver in use: ahci
	Kernel modules: ahci

